id,name,image,bio,career,age,height,cup,size,birthplace,genre,catch,tags
saito_asuka,齋藤飛鳥,https://dgjcvspr1jhox.cloudfront.net/article_images/20231115000015/03.jpg?20260328,元乃木坂46,乃木坂46の人気メンバーとして活躍後、モデルや女優として活動。小顔と独特の雰囲気で若者を中心に支持を集めている。,27,158,B,B78 W56 H83,東京都,モデル,小顔美女,"クール,可愛い系,スレンダー"
yoda_yuuki,与田祐希,https://store.kinokuniya.co.jp/wp-content/uploads/2024/12/与田祐希3rd-書影（紀限定）.jpg,乃木坂46,乃木坂46の人気メンバーとして活躍し、グラビアやドラマでも活動。小柄ながら存在感があり、幅広いファン層を持つ。,25,153,C,B80 W58 H83,福岡県,アイドル,ちっちゃいけど色気,"低身長,可愛い系,アイドル系"
endo_sakura,遠藤さくら,https://48pedia.org/images/thumb/d/dd/2026年乃木坂46プロフィール_遠藤さくら.jpg/640px-2026年乃木坂46プロフィール_遠藤さくら.jpg,乃木坂46,乃木坂46のセンター経験を持ち、グループの中心メンバーとして活躍。透明感あるビジュアルで人気を集めている。,24,164,C,B78 W57 H84,愛知県,アイドル,透明感センター,"透明感,清楚,アイドル系"
kubo_shiori,久保史緒里,https://savvy.jp/wp-content/uploads/2023/11/230728kwn_0214.jpg,乃木坂46,乃木坂46のメンバーとして活動し、演技やラジオでも活躍。知的で落ち着いた雰囲気が魅力。,25,161,C,B80 W58 H84,宮城県,アイドル,文学少女,"清楚,クール,アイドル系"
yamashita_mizuki,山下美月,https://mizukiyamashita.com/images/36/a39/16cbf047b470c976e7b8ddefa6622.jpg,乃木坂46,乃木坂46の人気メンバーとして活動し、ドラマやモデルとしても活躍。多方面で才能を発揮している。,26,160,D,B82 W59 H85,東京都,アイドル,万能アイドル,"可愛い系,女優系,アイドル系"
uemura_akari,上村ひなの,https://cdn.hinatazaka46.com/images/14/d04/9a8fe13f4636d8ca094adb4f9726e/1000_1000_102400.jpg,日向坂46,日向坂46の若手メンバーとして活動し、独特のキャラクターで人気を集める。バラエティでも活躍。,22,162,C,B78 W58 H84,東京都,アイドル,天然系,"可愛い系,ロリ系,アイドル系"
kanemura_miku,金村美玖,https://img-mdpr.freetls.fastly.net/article/6D7_/nm/6D7_-eY9tkkPsk_Bq0LVSeZGhWfMHXvWf2v7DIJl7Og.jpg?width=750&disable=upscale&auto=webp&quality=80,日向坂46,日向坂46の人気メンバーとして活動し、モデルやメディア出演も増加。安定した人気を誇る。,23,163,C,B80 W58 H85,埼玉県,アイドル,おすし,"可愛い系,清楚,アイドル系"
kosaka_nao,小坂菜緒,https://cdn.hinatazaka46.com/files/14/diary/official/member/moblog/202505/mobiXVTKv.jpg,日向坂46,日向坂46のセンターとして活躍し、グループを代表する存在。モデルやドラマ出演でも人気を集めている。,23,161,C,B80 W58 H84,大阪府,アイドル,絶対的エース,"可愛い系,清楚,アイドル系"